<?xml version="1.0" encoding="UTF-8"?>
<style xmlns="http://www.woltlab.com" xmlns:xsi="http://www.w3.org/2001/XMLSchema-instance" xsi:schemaLocation="http://www.woltlab.com http://www.woltlab.com/XSD/maelstrom/style.xsd">
	<general>
		<stylename><![CDATA[Lantia Default Style]]></stylename>
		<date><![CDATA[2015-10-22]]></date>
		<copyright><![CDATA[WoltLab GmbH]]></copyright>
		<license><![CDATA[GNU Lesser General Public License]]></license>
		<version>2.2.0 Alpha 1</version>
		<image><![CDATA[stylePreview-defaultStyle.png]]></image> 
	</general>
	
	<author>
		<authorname><![CDATA[Alexander Ebert, Marcel Werk]]></authorname>
		<authorurl><![CDATA[https://www.woltlab.com]]></authorurl>
	</author>
	
	<files>
		<variables><![CDATA[variables.xml]]></variables>
	</files>
</style>
